{
  "reviewer_id": "reviewer",
  "reviewed_node_id": "worker",
  "question": "Is every audit conclusion supported by reproducible local evidence?",
  "result": "pass",
  "feedback": "Pilot harness review confirms the graph contract requires local evidence and preserves a read-only boundary.",
  "evidence": [{"claim": "The graph binds the reviewer to the worker and review-report schema.", "verdict": "verified", "source": "pilot-1-ecc-skill-library-audit.json"}],
  "timestamp": "2026-08-09T00:00:00Z"
}
