{
  "reviewer_id": "reviewer",
  "reviewed_node_id": "worker",
  "question": "Does every finding preserve the no-deployment-authority boundary?",
  "result": "pass",
  "feedback": "Pilot harness review confirms the graph records evidence findings only and routes sharing through an explicit gate.",
  "evidence": [{"claim": "The graph has no deployment-capable node or runtime reference.", "verdict": "verified", "source": "pilot-2-avalanche-release-security-audit.json"}],
  "timestamp": "2026-08-09T00:00:00Z"
}
